exp_id	timestamp	target_day	concept	qa_score	judge_score	combined_score	verdict	change_summary	prompts_hash
0042	2026-03-13T20:16:11.450460+00:00	thursday	Jalapeño Corn Dog Bites	89	5	73.4	DISCARD	        "- Your message should sound like YOU and nobody else. Voice first, content second.\n"	234570a1
0043	2026-03-13T20:18:14.729859+00:00	thursday	Jalapeño Corn Dog Bites	88	5	72.8	DISCARD	        "- Never start a message with 'I' - find a different entry point into the thought."	a8b47a1c
0044	2026-03-13T20:20:24.319636+00:00	thursday	Jalapeño Corn Dog Bites	87	2	60.2	DISCARD	        "- Your message should sound like YOU and nobody else. Voice first, content second.\n"	e80a36b6
0045	2026-03-13T20:22:40.702607+00:00	thursday	Jalapeño Corn Dog Bites	0	n/a	0	CRASH	eval error: Error code: 500 - {'type': 'error', 'error': {'type': 'api_error', 'message': 'Internal server error'}, 'request_id': 'req_011CZ1hdzUjdwJtKFnToaoau'}	n/a
0046	2026-03-13T20:24:59.271028+00:00	thursday	Jalapeño Corn Dog Bites	88	7	80.8	DISCARD	no visible change	1d93f6ac
0047	2026-03-13T20:27:10.409320+00:00	thursday	Jalapeño Corn Dog Bites	94	7	84.4	DISCARD	        "- When you agree with someone, show it through a specific detail, not generic affirmation.\n"	d73306d9
0048	2026-03-13T20:29:13.701727+00:00	thursday	Jalapeño Corn Dog Bites	93	7	83.8	DISCARD	        "- When you agree with someone, show it through a specific detail, not generic affirmation.\n"	d73306d9
0049	2026-03-13T20:30:40.554965+00:00	thursday	Jalapeño Corn Dog Bites	83	5	69.8	DISCARD	        "- Pick ONE thing from the conversation to respond to. Don't try to cover everything."	c90669c8
0050	2026-03-13T20:32:37.153771+00:00	thursday	Jalapeño Corn Dog Bites	89	5	73.4	DISCARD	        "- When you agree with someone, show it through a specific detail, not generic affirmation."	803c568b
